{
  "pack_id": "speaking-official-sample",
  "pack_version": "0.1.0",
  "schema_version": "1.0.0",
  "title": "Official IELTS Speaking Topic Bank (2026-08 snapshot)",
  "modules": [
    "speaking"
  ],
  "licence": {
    "name": "Curated legal data (owner-screened)",
    "redistributable": true
  },
  "redistributable": true,
  "contents": {
    "counts": {
      "reading_items": 0,
      "reading_questions": 0,
      "speaking_topics": 113,
      "speaking_questions": 280,
      "writing_prompts": 0,
      "writing_essays": 0
    },
    "seasons": [
      "2026-05-08"
    ],
    "source_types": [
      "official_sample",
      "third_party"
    ]
  },
  "notes": "雅思口语 Part 1-3 公开话题快照。原 reading-official-sample 包中的 25 篇官方阅读题已于 2026-09-01 全部移出（归档于学习 workspace 的 ielts-data/_archive/），本包仅保留口语话题。计数由 refresh_pack_json.py 按磁盘重算。"
}
