{
  "pack_id": "reading-official-sample",
  "pack_version": "0.1.0",
  "schema_version": "1.0.0",
  "title": "Official Sample Items (reading + speaking)",
  "modules": [
    "reading",
    "speaking"
  ],
  "licence": {
    "name": "Curated legal data (owner-screened)",
    "redistributable": true
  },
  "redistributable": true,
  "contents": {
    "counts": {
      "reading_items": 25,
      "reading_questions": 149,
      "speaking_topics": 113,
      "speaking_questions": 651,
      "writing_prompts": 0,
      "writing_essays": 0
    },
    "seasons": [
      "2026-05-08"
    ],
    "source_types": [
      "official_sample",
      "third_party"
    ]
  },
  "notes": "由项目所有者筛选整理的合法数据，随专家包分发。"
}
